cite_key,entry_type,bib_title,bib_date,doi,format_valid,resolves,status_code,crossref_title,crossref_year,title_similarity,year_match,error,suggested_doi,suggested_title,suggested_year,suggestion_score,isbn,isbn_confirmed,isbn_ol_found,isbn_gb_found,isbn_found_title,isbn_found_year,isbn_title_match,isbn_found_doi
Gutting2020-pn,ARTICLE,"Contentious activities, disrespectful protesters: Effect of protest context on protest support and mobilization across ideology and authoritarianism",2020-09,10.1007/s11109-018-09523-8,True,True,200,"Contentious Activities, Disrespectful Protesters: Effect of Protest Context on Protest Support and Mobilization Across Ideology and Authoritarianism",2020,1.0,yes,,,,,,,,,,,,,
Massoud2019-km,ARTICLE,Protests and the Arab spring: An empirical investigation,2019-07,10.1086/704001,True,True,200,Protests and the Arab Spring: An Empirical Investigation,2019,1.0,yes,,,,,,,,,,,,,
AKM-Khairul-Islam2021-mv,ARTICLE,"Authoritarian rule, legitimacy crisis, and destruction of political institutions",2021-03-29,10.36609/bjpa.v18i1.199,True,True,200,"Authoritarian Rule, Legitimacy Crisis, and Destruction of Political Institutions",2021,1.0,yes,,,,,,,,,,,,,
Gorman2019-gr,ARTICLE,Who doesn’t want democracy? A multilevel analysis of elite and mass attitudes,2019-06,10.1177/0731121418785626,True,True,200,Who Doesn’t Want Democracy? A Multilevel Analysis of Elite and Mass Attitudes,2019,1.0,yes,,,,,,,,,,,,,
Samosir2021-jh,ARTICLE,Indonesian democracy comes when the kingdom system has strong roots: Serious problems leading to simultaneous national elections in 2024,2021-06-26,10.3968/12171,True,False,404,,,,,DOI not found (404),,,,,,,,,,,,
Yang2021-qn,ARTICLE,Comparing the political trust and civic political culture of democracy or authoritarian in Asian countries,2021-03-11,10.29121/granthaalayah.v9.i2.2021.3491,True,True,200,COMPARING THE POLITICAL TRUST AND CIVIC POLITICAL CULTURE OF DEMOCRACY OR AUTHORITARIAN IN ASIAN COUNTRIES,2021,1.0,yes,,,,,,,,,,,,,
Mokhtari2008-vi,ARTICLE,"Pardon me for asking, but do you really want democracy in Iraq?",2008-08-15,10.1080/10803920802314002,True,True,200,"Pardon Me for Asking, but Do You Really Want Democracy in Iraq?",2008,1.0,yes,,,,,,,,,,,,,
Sabloff2016-ah,BOOK,Does everyone want democracy?: Insights from Mongolia,2016-06-16,10.4324/9781315430218,True,True,200,Does Everyone Want Democracy?,2016,0.71,yes,,,,,,,,,,,,,
Zemtsov2022-ot,ARTICLE,The choice between democracy and authoritarian government in the minds of citizens of post-communist countries: Factors and dynamics,2022-06-28,10.19181/socjour.2022.28.2.8987,True,True,200,The Choice between Democracy and Authoritarian Government in the Minds of Citizens  of Post-Communist Countries: Factors and Dynamics,2022,1.0,yes,,,,,,,,,,,,,
Lechler2019-cc,MISC,Individual life horizon influences attitudes toward democracy,2019-01,10.5282/UBM/EPUB.59706,True,False,404,,,,,DOI not found (404),,,,,,,,,,,,
Garrido2020-ed,ARTICLE,Democracy as disorder: Institutionalized sources of democratic ambivalence among the upper and middle class in manila,2020-06-01,10.1093/sf/soaa046,True,True,200,Democracy as Disorder: Institutionalized Sources of Democratic Ambivalence Among the Upper and Middle Class in Manila,2020,1.0,yes,,,,,,,,,,,,,
Scott2019-gs,ARTICLE,Our democracy: Czech adolescents talk about the meaning of democracy and attitudes toward immigrants,2019-12,10.1111/asap.12175,True,True,200,Our Democracy: Czech Adolescents Talk About the Meaning of Democracy and Attitudes Toward Immigrants,2019,1.0,yes,,,,,,,,,,,,,
Karkour2019-sc,ARTICLE,Why on earth would some people reject democracy? An autoethnographic reflection on education and democracy in Egypt,2019-08,10.1007/s10780-019-09362-4,True,True,200,Why on Earth Would Some People Reject Democracy? An Autoethnographic Reflection on Education and Democracy in Egypt,2019,1.0,yes,,,,,,,,,,,,,
Dore2014-ow,INBOOK,"Democracy is not the only game in town! Democratic and authoritarian attitudes in Indonesia, Korea, and Thailand",2014-01,10.1057/9781137397508_2,True,True,200,"Democracy Is Not the Only Game in Town! Democratic and Authoritarian Attitudes in Indonesia, Korea, and Thailand",2014,1.0,yes,,,,,,,,,,,,,
Weiss2004-ah,INBOOK,"Parents, Adolescence, and Attitudes Toward Democracy",2004-01,10.1007/978-3-322-80931-5_15,True,True,200,"Parents, Adolescence, and Attitudes Toward Democracy",2004,1.0,yes,,,,,,,,,,,,,
Fair2018-qr,ARTICLE,Conceptions of Shari`a and support for militancy and democratic values: Evidence from Pakistan,2018-07,10.1017/psrm.2016.55,True,True,200,Conceptions of <i>Shari`a</i> and Support for Militancy and Democratic Values: Evidence From Pakistan,2018,0.99,yes,,,,,,,,,,,,,
Krizsan2018-ua,ARTICLE,Towards a conceptual framework for struggles over democracy in backsliding states: Gender equality policy in Central eastern Europe,2018-09-14,10.17645/pag.v6i3.1414,True,True,200,Towards a Conceptual Framework for Struggles over Democracy in Backsliding States: Gender Equality Policy in Central Eastern Europe,2018,1.0,yes,,,,,,,,,,,,,
Tomini2018-iv,ARTICLE,Varieties of contemporary democratic breakdown and regression: A comparative analysis: VARIETIES OF CONTEMPORARY DEMOCRATIC BREAKDOWN AND REGRESSION,2018-08,10.1111/1475-6765.12244,True,True,200,Varieties of contemporary democratic breakdown and regression: A comparative analysis,2018,0.73,yes,,,,,,,,,,,,,
Graham2020-jr,ARTICLE,"Democracy in America? Partisanship, polarization, and the robustness of support for democracy in the United States",2020-05,10.1017/s0003055420000052,True,True,200,"Democracy in America? Partisanship, Polarization, and the Robustness of Support for Democracy in the United States",2020,1.0,yes,,,,,,,,,,,,,
Berman2017-rg,ARTICLE,The pipe dream of undemocratic liberalism,2017,10.1353/jod.2017.0041,True,True,200,The Pipe Dream of Undemocratic Liberalism,2017,1.0,yes,,,,,,,,,,,,,
Foweraker2000-an,ARTICLE,Measuring liberal democratic performance: An empirical and conceptual critique,2000-09,10.1111/1467-9248.00282,True,True,200,Measuring Liberal Democratic Performance: An Empirical and Conceptual Critique,2000,1.0,yes,,,,,,,,,,,,,
Mechkova2017-na,ARTICLE,How much democratic backsliding?,2017,10.1353/jod.2017.0075,True,True,200,How Much Democratic Backsliding?,2017,1.0,yes,,,,,,,,,,,,,
Gandhi2019-en,ARTICLE,Committed or conditional democrats? Opposition dynamics in electoral autocracies,2019-10,10.1111/ajps.12441,True,True,200,Committed or Conditional Democrats? Opposition Dynamics in Electoral Autocracies,2019,1.0,yes,,,,,,,,,,,,,
Simpser2011-kz,ARTICLE,Can international election monitoring harm governance?,2011,10.2139/ssrn.2047555,True,True,200,Can International Election Monitoring Harm Governance?,2011,1.0,yes,,,,,,,,,,,,,
Schedler2007-pv,ARTICLE,Democrats with adjectives: Linking direct and indirect measures of democratic support,2007-08,10.1111/j.1475-6765.2007.00708.x,True,True,200,Democrats with adjectives: Linking direct and indirect measures of democratic support,2007,1.0,yes,,,,,,,,,,,,,
Jenkins2008-cr,ARTICLE,A social movement society?: A cross-national analysis of protest potential,2008-09,10.2753/ijs0020-7659380301,True,True,200,A Social Movement Society?: A Cross-National Analysis of Protest Potential,2008,1.0,yes,,,,,,,,,,,,,
Tessler2002-wj,ARTICLE,Islam and democracy in the middle east: The impact of religious orientations on attitudes toward democracy in four Arab countries,2002-04,10.2307/4146957,True,True,200,Islam and Democracy in the Middle East: The Impact of Religious Orientations on Attitudes toward Democracy in Four Arab Countries,2002,1.0,yes,,,,,,,,,,,,,
Huang2019-ia,ARTICLE,"Media, protest diffusion, and authoritarian resilience",2019-01,10.1017/psrm.2016.25,True,True,200,"Media, Protest Diffusion, and Authoritarian Resilience",2019,1.0,yes,,,,,,,,,,,,,
Nam2007-wr,ARTICLE,Rough days in democracies: Comparing protests in democracies,2007-01,10.1111/j.1475-6765.2006.00645.x,True,True,200,Rough days in democracies: Comparing protests in democracies,2007,1.0,yes,,,,,,,,,,,,,
Sluka2020-rw,ARTICLE,"Too dangerous for fieldwork? The challenge of institutional risk-management in primary research on conflict, violence and ‘Terrorism’",2020-04-02,10.1080/21582041.2018.1498534,True,True,200,"Too dangerous for fieldwork? The challenge of institutional risk-management in primary research on conflict, violence and ‘Terrorism’",2020,1.0,yes,,,,,,,,,,,,,
Young2020-bg,ARTICLE,Social movements in Cambodia: why they succeed or fail,2020-12,10.1057/s41268-019-00175-7,True,True,200,Social movements in Cambodia: why they succeed or fail,2020,1.0,yes,,,,,,,,,,,,,
Bove2015-xr,ARTICLE,"Elite co-optation, repression, and coups in autocracies",2015-05-27,10.1080/03050629.2015.1006727,True,True,200,"Elite Co-optation, Repression, and Coups in Autocracies",2015,1.0,yes,,,,,,,,,,,,,
Ghosh2018-nl,ARTICLE,Risky fieldwork: The problems of ethics in the field,2018-11-01,10.1016/j.erss.2018.07.020,True,True,200,Risky fieldwork: The problems of ethics in the field,2018,1.0,yes,,,,,,,,,,,,,
Young2021-oz,INBOOK,"A peasant movement, kleptocratic elites and the global supply chains",2021-01,10.1007/978-981-33-6112-6_3,True,True,200,"A Peasant Movement, Kleptocratic Elites and the Global Supply Chains",2021,1.0,yes,,,,,,,,,,,,,
Kuhn2018-hk,ARTICLE,Large-scale land acquisitions and violence in post-war societies,2018-01-02,10.1080/23802014.2018.1454847,True,True,200,Large-scale land acquisitions and violence in post-war societies,2018,1.0,yes,,,,,,,,,,,,,
Trejo2012-rh,BOOK,"Cambridge studies in comparative politics: Popular movements in autocracies: Religion, repression, and indigenous collective action in Mexico: Religion, repression, and indigenous collective action in Mexico",2012-08-13,10.1017/cbo9781139043250,True,True,200,Popular Movements in Autocracies,2012,0.28,yes,,,,,,,,,,,,,
Josua2021-jg,INREFERENCE,The Legitimation of Repression in Autocracies,2021-08-31,10.1093/acrefore/9780190228637.013.1988,True,True,200,The Legitimation of Repression in Autocracies,2021,1.0,yes,,,,,,,,,,,,,
Young2021-ky,INBOOK,Political durability and protests,2021-01,10.1007/978-981-33-6112-6_1,True,True,200,Political Durability and Protests,2021,1.0,yes,,,,,,,,,,,,,
Young2021-ev,INBOOK,"The logic of ruler survival, and consequences for discontents in southeast Asia",2021-01,10.1007/978-981-33-6112-6_8,True,True,200,"The Logic of Ruler Survival, and Consequences for Discontents in Southeast Asia",2021,1.0,yes,,,,,,,,,,,,,
Hennings2019-xv,ARTICLE,The dark underbelly of land struggles: the instrumentalization of female activism and emotional resistance in Cambodia,2019-01-02,10.1080/14672715.2018.1547881,True,True,200,The dark underbelly of land struggles: the instrumentalization of female activism and emotional resistance in Cambodia,2019,1.0,yes,,,,,,,,,,,,,
Fontes2004-le,ARTICLE,"Ethics in violence against women research: the sensitive, the dangerous, and the overlooked",2004-01,10.1207/s15327019eb1402_4,True,True,200,"Ethics in Violence Against Women Research: The Sensitive, the Dangerous, and the Overlooked",2004,1.0,yes,,,,,,,,,,,,,
Herkenrath2011-cj,ARTICLE,Protest events in international press coverage: An empirical critique of cross-national conflict databases,2011-06,10.1177/0020715211405417,True,True,200,Protest events in international press coverage: An empirical critique of cross-national conflict databases,2011,1.0,yes,,,,,,,,,,,,,
Arnold2017-mk,ARTICLE,"Civil society, political society and politics of disorder in Cambodia",2017-09,10.1016/j.polgeo.2017.03.008,True,True,200,"Civil society, political society and politics of disorder in Cambodia",2017,1.0,yes,,,,,,,,,,,,,
Reidy2015-xi,ARTICLE,The political socialization of youth in a post-conflict community,2015-03,10.1016/j.ijintrel.2014.12.005,True,True,200,The political socialization of youth in a post-conflict community,2015,1.0,yes,,,,,,,,,,,,,
Perez-Linan2019-xv,ARTICLE,"Presidential hegemony and democratic backsliding in Latin America, 1925–2016",2019-05-19,10.1080/13510347.2019.1566321,True,True,200,"Presidential hegemony and democratic backsliding in Latin America, 1925–2016",2019,1.0,yes,,,,,,,,,,,,,
Zwi2006-lq,ARTICLE,Placing ethics in the centre: negotiating new spaces for ethical research in conflict situations,2006,10.1080/17441690600673866,True,True,200,Placing ethics in the centre: Negotiating new spaces for ethical research in conflict situations,2006,1.0,yes,,,,,,,,,,,,,
Keremoglu2022-jh,ARTICLE,"Thin-skinned leaders: regime legitimation, protest issues, and repression in autocracies",2022-01,10.1017/psrm.2021.19,True,True,200,"Thin-skinned leaders: regime legitimation, protest issues, and repression in autocracies",2022,1.0,yes,,,,,,,,,,,,,
Aytac2017-wv,ARTICLE,Protests and repression in new democracies,2017-03,10.1017/s1537592716004138,True,True,200,Protests and Repression in New Democracies,2017,1.0,yes,,,,,,,,,,,,,
Belousov2007-bn,ARTICLE,Any port in a storm: fieldwork difficulties in dangerous and crisis-ridden settings,2007-05-01,10.1177/1468794107076019,True,True,200,Any port in a storm: fieldwork difficulties in dangerous and crisis-ridden settings,2007,1.0,yes,,,,,,,,,,,,,
Blair2003-wn,ARTICLE,Jump-starting democracy: Adult civic education and democratic participation in three countries,2003-03-01,10.1080/714000108,True,True,200,Jump-Starting Democracy: Adult Civic Education and Democratic Participation in Three Countries,2003,1.0,yes,,,,,,,,,,,,,
Smeltzer2012-zp,ARTICLE,Asking tough questions: The ethics of studying activism in democratically restricted environments,2012-04-01,10.1080/14742837.2012.664905,True,True,200,Asking Tough Questions: The Ethics of Studying Activism in Democratically Restricted Environments,2012,1.0,yes,,,,,,,,,,,,,
Schneider2017-fm,ARTICLE,"Legitimation, Kooptation und Repression und das Überleben von elektoralen Autokratien",2017-06-01,10.1007/s12286-017-0332-2,True,True,200,"Legitimation, cooptation, and repression and the survival of electoral autocracies",2017,0.75,yes,,,,,,,,,,,,,
Kefford2013-oy,ARTICLE,Bridging the information gap: A survey of politics and international relations PhD students in Australia,2013-12-01,10.1080/10361146.2013.840431,True,True,200,Bridging the information gap: A survey of politics and international relations PhD students in Australia,2013,1.0,yes,,,,,,,,,,,,,
Ward2022-ko,ARTICLE,Labour and electoral politics in Cambodia,2022-08-08,10.1080/00472336.2021.1963810,True,True,200,Labour and Electoral Politics in Cambodia,2022,1.0,yes,,,,,,,,,,,,,
Morgenbesser2017-jd,ARTICLE,"The autocratic mandate: elections, legitimacy and regime stability in Singapore",2017-03-04,10.1080/09512748.2016.1201134,True,True,200,"The autocratic mandate: elections, legitimacy and regime stability in Singapore",2017,1.0,yes,,,,,,,,,,,,,
Collins2012-ls,ARTICLE,Islamic religiosity and regime preferences: Explaining support for democracy and political Islam in Central Asia and the Caucasus,2012-09,10.1177/1065912912450554,True,True,200,Islamic Religiosity and Regime Preferences,2012,0.49,yes,,,,,,,,,,,,,
Collier1997-rr,ARTICLE,Democracy with adjectives: Conceptual innovation in comparative research,1997-04,10.1353/wp.1997.0009,True,True,200,Democracy with Adjectives: Conceptual Innovation in Comparative Research,1997,1.0,yes,,,,,,,,,,,,,
Buzogany2017-xf,ARTICLE,Illiberal democracy in Hungary: authoritarian diffusion or domestic causation?,2017-11-10,10.1080/13510347.2017.1328676,True,True,200,Illiberal democracy in Hungary: authoritarian diffusion or domestic causation?,2017,1.0,yes,,,,,,,,,,,,,
Ding2021-sg,ARTICLE,Democratic decoupling,2021-01-02,10.1080/13510347.2020.1842361,True,True,200,Democratic decoupling,2021,1.0,yes,,,,,,,,,,,,,
Grzymala-Busse2019-yr,ARTICLE,How populists rule: The consequences for democratic governance,2019-10,10.1086/705570,True,True,200,How Populists Rule: The Consequences for Democratic Governance,2019,1.0,yes,,,,,,,,,,,,,
Driessen2018-xt,ARTICLE,Sources of Muslim democracy: the supply and demand of religious policies in the Muslim world,2018-01-02,10.1080/13510347.2017.1334054,True,True,200,Sources of Muslim democracy: the supply and demand of religious policies in the Muslim world,2018,1.0,yes,,,,,,,,,,,,,
Aspinall2019-sd,ARTICLE,Southeast Asia's troubling elections: Nondemocratic pluralism in Indonesia,2019,10.1353/jod.2019.0055,True,True,200,Southeast Asia's Troubling Elections: Nondemocratic Pluralism in Indonesia,2019,1.0,yes,,,,,,,,,,,,,
Carothers2002-bg,ARTICLE,The end of the transition paradigm,2002,10.1353/jod.2002.0003,True,True,200,The End of the Transition Paradigm,2002,1.0,yes,,,,,,,,,,,,,
Jones2015-ab,ARTICLE,Seeing like an autocrat: Liberal social engineering in an illiberal state,2015-03,10.1017/s1537592714003119,True,True,200,Seeing Like an Autocrat: Liberal Social Engineering in an Illiberal State,2015,1.0,yes,,,,,,,,,,,,,
Nannestad2008-jq,ARTICLE,"What have we learned about generalized trust, if anything?",2008-06-01,10.1146/annurev.polisci.11.060606.135412,True,True,200,"What Have We Learned About Generalized Trust, If Anything?",2008,1.0,yes,,,,,,,,,,,,,
Schwartzberg2015-hf,ARTICLE,Epistemic democracy and its challenges,2015-05-11,10.1146/annurev-polisci-110113-121908,True,True,200,Epistemic Democracy and Its Challenges,2015,1.0,yes,,,,,,,,,,,,,
Hatemi2016-ph,ARTICLE,Give me attitudes,2016-05-11,10.1146/annurev-polisci-103113-034929,True,True,200,Give Me Attitudes,2016,1.0,yes,,,,,,,,,,,,,
Gerring2022-dp,ARTICLE,Does democracy matter?,2022-05-12,10.1146/annurev-polisci-060820-060910,True,True,200,Does Democracy Matter?,2022,1.0,yes,,,,,,,,,,,,,
Schedler2002-eg,ARTICLE,The Menu of Manipulation,2002,10.1353/jod.2002.0031,True,True,200,Elections Without Democracy: The Menu of Manipulation,2002,0.63,yes,,,,,,,,,,,,,
Brauen1977-ur,ARTICLE,Political socialization: A topical bibliography,1977-03-01,10.1177/0044118x7700800304,True,True,200,Political Socialization,1977,0.67,yes,,,,,,,,,,,,,
Weiss2013-px,ARTICLE,"Authoritarian signaling, mass audiences, and nationalist protest in China",2013-01,10.1017/s0020818312000380,True,True,200,"Authoritarian Signaling, Mass Audiences, and Nationalist Protest in China",2013,1.0,yes,,,,,,,,,,,,,
Chu2008-fk,BOOK,How East Asians view democracy,2008,10.7312/chu-14534,True,True,200,How East Asians View Democracy,2008,1.0,yes,,,,,,,,,,,,,
Schmitter1991-tj,ARTICLE,What democracy is. . . And is not,1991,10.1353/jod.1991.0033,True,True,200,What Democracy Is. . . and Is Not,1991,1.0,yes,,,,,,,,,,,,,
Murphy2013-mn,BOOK,Tree of salvation: Yggdrasil and the cross in the north,2013-11-28,10.1093/acprof:oso/9780199948611.001.0001,True,True,200,Tree of Salvation,2013,0.48,yes,,,,,,,,,,,,,
Onis2016-em,ARTICLE,Turkey’s two elections: The AKP comes back,2016,10.1353/jod.2016.0021,True,True,200,Turkey’s Two Elections: The AKP Comes Back,2016,1.0,yes,,,,,,,,,,,,,
Kuhonta2014-qk,ARTICLE,Democratic regression in Thailand: The ambivalent role of civil society and political institutions,2014-12-30,10.1355/cs36-3a,True,True,200,Democratic Regression in Thailand: The Ambivalent Role of Civil Society and Political Institutions,2014,1.0,yes,,,,,,,,,,,,,
Thompson2016-gc,ARTICLE,Bloodied democracy: Duterte and the death of liberal reformism in the Philippines,2016-12,10.1177/186810341603500303,True,True,200,Bloodied Democracy: Duterte and the Death of Liberal Reformism in the Philippines,2016,1.0,yes,,,,,,,,,,,,,
Nadeau1993-vo,ARTICLE,Accepting the election outcome: The effect of participation on losers' consent,1993-10,10.1017/s0007123400006736,True,True,200,Accepting the Election Outcome: The Effect of Participation on Losers' Consent,1993,1.0,yes,,,,,,,,,,,,,
Furman2022-nt,ARTICLE,"The role of family, peers and school in political socialization: Quantitative and qualitative study of Polish young adults’ experiences",2022-02-01,10.1386/ctl_00085_1,True,True,200,"The role of family, peers and school in political socialization: Quantitative and qualitative study of Polish young adults’ experiences",2022,1.0,yes,,,,,,,,,,,,,
Vladisavljevic2014-ya,ARTICLE,Popular protest in authoritarian regimes: evidence from communist and post-communist states,2014-04-03,10.1080/14683857.2014.901725,True,True,200,Popular protest in authoritarian regimes: evidence from communist and post-communist states,2014,1.0,yes,,,,,,,,,,,,,
Guerin2004-oy,ARTICLE,"Tolerance, protest and democratic transition: Survey evidence from 13 post‐communist countries",2004-05,10.1111/j.1475-6765.2004.00158.x,True,True,200,"Tolerance, protest and democratic transition: Survey evidence from 13 post‐communist countries",2004,1.0,yes,,,,,,,,,,,,,
Lorentzen2010-nu,ARTICLE,Regularizing rioting: Permitting public protest in an authoritarian regime,2010,10.2139/ssrn.995330,True,True,200,Regularizing Rioting: Permitting Public Protest in an Authoritarian Regime,2010,1.0,yes,,,,,,,,,,,,,
Stevens1975-jp,ARTICLE,Protest movement in an authoritarian regime: The Mexican case,1975-04,10.2307/421224,True,True,200,Protest Movement in an Authoritarian Regime: The Mexican Case,1975,1.0,yes,,,,,,,,,,,,,
Lankina2020-mw,ARTICLE,Protest in electoral autocracies: a new dataset,2020-01-02,10.1080/1060586x.2019.1656039,True,True,200,Protest in electoral autocracies: a new dataset,2020,1.0,yes,,,,,,,,,,,,,
Tertytchnaya2020-lc,ARTICLE,Electoral protests and political attitudes under electoral authoritarianism,2020-01,10.1086/705815,True,True,200,Electoral Protests and Political Attitudes under Electoral Authoritarianism,2020,1.0,yes,,,,,,,,,,,,,
Barakat2021-jb,ARTICLE,"Determinants of the Arab Spring protests in Tunisia, Egypt, and Libya: What have we learned?",2021-07-23,10.3390/socsci10080282,True,True,200,"Determinants of the Arab Spring Protests in Tunisia, Egypt, and Libya: What Have We Learned?",2021,1.0,yes,,,,,,,,,,,,,
Solt2015-wo,ARTICLE,Economic inequality and nonviolent protest: Economic inequality and nonviolent protest,2015-11,10.1111/ssqu.12198,True,True,200,Economic Inequality and Nonviolent Protest*,2015,0.66,yes,,,,,,,,,,,,,
Way2005-px,ARTICLE,"Authoritarian state building and the sources of regime competitiveness in the fourth wave: The cases of Belarus, Moldova, Russia, and Ukraine",2005-01,10.1353/wp.2005.0018,True,True,200,"Authoritarian State Building and the Sources of Regime Competitiveness in the Fourth Wave: The Cases of Belarus, Moldova, Russia, and Ukraine",2005,1.0,yes,,,,,,,,,,,,,
Dickey2001-ap,ARTICLE,The politics of democratization in Korea: The role of civil society,2001-12,10.1080/12294659.2001.10804986,True,True,200,The Politics of Democratization in Korea: The Role of Civil Society,2001,1.0,yes,,,,,,,,,,,,,
Yu2022-do,ARTICLE,Implications of analysis on Korean democracy for political education,2022-07-30,10.18230/tjye.2022.30.4.161,True,True,200,Implications of Analysis on Korean Democracy for Political Education,2022,1.0,yes,,,,,,,,,,,,,
Porteux2016-fu,ARTICLE,Public ordering of private coercion: Urban redevelopment and democratization in South Korea,2016-11,10.1017/jea.2016.20,True,True,200,PUBLIC ORDERING OF PRIVATE COERCION: URBAN REDEVELOPMENT AND DEMOCRATIZATION IN SOUTH KOREA,2016,1.0,yes,,,,,,,,,,,,,
Fleckenstein2019-ln,ARTICLE,"The political economy of education and skills in South Korea: democratisation, liberalisation and education reform in comparative perspective",2019-03-04,10.1080/09512748.2018.1443155,True,True,200,"The political economy of education and skills in South Korea: democratisation, liberalisation and education reform in comparative perspective",2019,1.0,yes,,,,,,,,,,,,,
Bae2013-vy,ARTICLE,Civil society and local activism in South Korea's local democratization,2013-03,10.1080/13510347.2011.650913,True,True,200,Civil society and local activism in South Korea's local democratization,2013,1.0,yes,,,,,,,,,,,,,
Hunter2019-ht,ARTICLE,Bolsonaro and Brazil's illiberal backlash,2019,10.1353/jod.2019.0005,True,True,200,Bolsonaro and Brazil's Illiberal Backlash,2019,1.0,yes,,,,,,,,,,,,,
Nasr2005-kp,ARTICLE,"The rise of ""Muslim democracy""",2005,10.1353/jod.2005.0032,True,True,200,"The Rise of ""Muslim Democracy""",2005,1.0,yes,,,,,,,,,,,,,
Gol2017-hy,ARTICLE,"The paradoxes of ‘new’ Turkey: Islam, illiberal democracy and republicanism",2017-07,10.1093/ia/iix135,True,True,200,"The paradoxes of ‘new’ Turkey: Islam, illiberal democracy and republicanism",2017,1.0,yes,,,,,,,,,,,,,
Wilson2015-fa,ARTICLE,Illiberal democracy and violent conflict in contemporary Indonesia,2015-11-10,10.1080/13510347.2014.949680,True,True,200,Illiberal democracy and violent conflict in contemporary Indonesia,2015,1.0,yes,,,,,,,,,,,,,
Croissant2021-zk,ARTICLE,Democratic regression in Asia: introduction,2021-01-02,10.1080/13510347.2020.1851203,True,True,200,Democratic regression in Asia: introduction,2021,1.0,yes,,,,,,,,,,,,,
Grzebalska2018-ul,ARTICLE,The gendered modus operandi of the illiberal transformation in Hungary and Poland,2018-05,10.1016/j.wsif.2017.12.001,True,True,200,The gendered modus operandi of the illiberal transformation in Hungary and Poland,2018,1.0,yes,,,,,,,,,,,,,
Bustikova2017-ct,ARTICLE,The illiberal turn or swerve in Central Europe?,2017-12-29,10.17645/pag.v5i4.1156,True,True,200,The Illiberal Turn or Swerve in Central Europe?,2017,1.0,yes,,,,,,,,,,,,,
Norris2017-fv,ARTICLE,Is western democracy backsliding? Diagnosing the risks,2017,10.2139/ssrn.2933655,True,True,200,Is Western Democracy Backsliding? Diagnosing the Risks,2017,1.0,yes,,,,,,,,,,,,,
Kotzian2011-gs,ARTICLE,Public support for liberal democracy,2011-01,10.1177/0192512110375938,True,True,200,Public support for liberal democracy,2011,1.0,yes,,,,,,,,,,,,,
Mudde2012-bn,BOOK,Populism in Europe and the Americas: Threat or corrective for democracy?,2012-05-28,10.1017/cbo9781139152365,True,True,200,Populism in Europe and the Americas,2012,0.67,yes,,,,,,,,,,,,,
