cite_key,entry_type,bib_title,bib_date,doi,format_valid,resolves,status_code,crossref_title,crossref_year,title_similarity,year_match,error,suggested_doi,suggested_title,suggested_year,suggestion_score,isbn,isbn_confirmed,isbn_ol_found,isbn_gb_found,isbn_found_title,isbn_found_year,isbn_title_match,isbn_found_doi
Rozario2003-rv,ARTICLE,"""delicious horrors"": Mass culture, the Red Cross, and the appeal of modern American humanitarianism",2003,10.1353/aq.2003.0026,True,True,200,"""Delicious Horrors"": Mass Culture, The Red Cross, and the Appeal of Modern American Humanitarianism",2003,1.0,yes,,,,,,,,,,,,,
Anderson2010-mq,BOOK,The Columbia history of the Vietnam war,2010-10-29,10.7312/ande13480,True,True,200,The Columbia History of the Vietnam War,2010,1.0,yes,,,,,,,,,,,,,
Ly2021-sz,ARTICLE,Competitive advantage and internationalization of a circular economy model in apparel multinationals,2021-01,10.1080/23311975.2021.1944012,True,True,200,Competitive advantage and internationalization of a circular economy model in apparel multinationals,2021,1.0,yes,,,,,,,,,,,,,
Seah2012-mp,ARTICLE,The treaty of amity and cooperation in southeast Asia: The issue of non-intervention and its accession by Australia and the USA,2012-12-01,10.1093/chinesejil/jms057,True,True,200,The Treaty of Amity and Cooperation in Southeast Asia: The Issue of Non-Intervention and its Accession by Australia and the USA,2012,1.0,yes,,,,,,,,,,,,,
Bignall2010-zw,BOOK,Deleuze and the Postcolonial,2010-04-15,10.1515/9780748637010,True,True,200,Deleuze and the Postcolonial,2010,1.0,yes,,,,,,,,,,,,,
Dyrstad2013-in,ARTICLE,"Does civil war breed authoritarian values? An empirical study of Bosnia-Herzegovina, Kosovo and Croatia",2013-12,10.1080/13510347.2012.688032,True,True,200,"Does civil war breed authoritarian values? An empirical study of Bosnia-Herzegovina, Kosovo and Croatia",2013,1.0,yes,,,,,,,,,,,,,
Schatz2009-rj,BOOK,Political ethnography: What immersion contributes to the study of politics,2009-09-18,10.7208/chicago/9780226736785.001.0001,True,True,200,Political Ethnography,2009,0.45,yes,,,,,,,,,,,,,
Harris2010-bz,ARTICLE,Rethinking Cambodian political discourse on territory: Genealogy of the Buddhist ritual boundary (sīmā),2010-06,10.1017/s0022463410000032,True,True,200,Rethinking Cambodian political discourse on territory: Genealogy of the Buddhist ritual boundary (<i>sīmā</i>),2010,0.99,yes,,,,,,,,,,,,,
Harris1993-kb,ARTICLE,Whiteness as Property,1993-06-01,10.2307/1341787,True,True,200,Whiteness as Property,1993,1.0,yes,,,,,,,,,,,,,
Kohn2013-dt,BOOK,How forests think: Toward an anthropology beyond the human,2013-09-13,10.1525/california/9780520276109.001.0001,True,True,200,How Forests Think,2013,0.46,yes,,,,,,,,,,,,,
Richards2014-hz,BOOK,Approaches and methods in language teaching,2014-04-16,10.1017/9781009024532,True,True,200,Approaches and Methods in Language Teaching,2014,1.0,yes,,,,,,,,,,,,,
Connell2018-oo,ARTICLE,Decolonizing sociology,2018-07,10.1177/0094306118779811,True,True,200,Decolonizing Sociology,2018,1.0,yes,,,,,,,,,,,,,
Foucault1982-lq,ARTICLE,The subject and power,1982-07-01,10.1086/448181,True,True,200,The Subject and Power,1982,1.0,yes,,,,,,,,,,,,,
Sher2023-pt,ARTICLE,The weight of the past,2023-01-02,10.1080/00048402.2021.1955288,True,True,200,The Weight of the Past,2023,1.0,yes,,,,,,,,,,,,,
Mabille2009-uq,BOOK,Nietzsche and the Anglo-Saxon tradition,2009-04-13,10.5040/9781472547125,True,True,200,Nietzsche and the Anglo-Saxon Tradition,2009,1.0,yes,,,,,,,,,,,,,
Nussbaum2006-mq,BOOK,"Frontiers of justice: Disability, nationality, species membership",2006-01-06,10.2307/j.ctv1c7zftw,True,True,200,Frontiers of Justice,2007,0.49,no,,,,,,,,,,,,,
Green2014-ok,INBOOK,Fouling the Nest,2014,10.1007/978-3-642-55230-4_19,True,True,200,Fouling the Nest,2014,1.0,yes,,,,,,,,,,,,,
Dunmire2012-qy,ARTICLE,Political discourse analysis: Exploring the language of politics and the politics of language: Political discourse analysis,2012-11,10.1002/lnc3.365,True,True,200,Political Discourse Analysis: Exploring the Language of Politics and the Politics of Language,2012,0.86,yes,,,,,,,,,,,,,
Golub2021-tu,ARTICLE,Pierre Bourdieu and politics,2021,10.2298/fid2104567g,True,True,200,Pierre Bourdieu and politics,2021,1.0,yes,,,,,,,,,,,,,
Bang2014-ob,ARTICLE,Between the cat and the principle: An encounter between Foucault's and Bourdieu's conceptualisations of power,2014-03,10.2304/power.2014.6.1.18,True,True,200,Between the Cat and the Principle: An Encounter between Foucault's and Bourdieu's Conceptualisations of Power,2014,1.0,yes,,,,,,,,,,,,,
Maclachlan2011-le,BOOK,Reading Derrida's of grammatology,2011-06-30,10.5040/9781472547361,True,True,200,Reading Derrida’s  Of Grammatology,2011,0.98,yes,,,,,,,,,,,,,
Paek2005-za,ARTICLE,Understanding celebrity endorsers in cross-cultural contexts: A content analysis of south Korean and US newspaper advertising,2005-07,10.1080/01292980500118292,True,True,200,Understanding Celebrity Endorsers in Cross-cultural Contexts: A Content Analysis of South Korean and US Newspaper Advertising,2005,1.0,yes,,,,,,,,,,,,,
Zhao2010-oc,ARTICLE,The China Model: can it replace the Western model of modernization?,2010-06,10.1080/10670561003666061,True,True,200,The China Model: can it replace the Western model of modernization?,2010,1.0,yes,,,,,,,,,,,,,
Hui2015-bq,INBOOK,The China dream: Revival of what historical greatness?,2015-03,10.1142/9789814611145_0001,True,True,200,The China Dream: Revival of What Historical Greatness?,2015,1.0,yes,,,,,,,,,,,,,
Geddes2018-lj,BOOK,"How dictatorships work: Power, personalization, and collapse",2018-07-31,10.1017/9781316336182,True,True,200,How Dictatorships Work,2018,0.56,yes,,,,,,,,,,,,,
Zhao2009-nh,ARTICLE,The mandate of heaven and performance legitimation in historical and contemporary China,2009-11,10.1177/0002764209338800,True,True,200,The Mandate of Heaven and Performance Legitimation in Historical and Contemporary China,2009,1.0,yes,,,,,,,,,,,,,
Albrecht2016-ow,ARTICLE,"Exit, resistance, loyalty: Military behavior during unrest in authoritarian regimes",2016-03,10.1017/s1537592715003217,True,True,200,"Exit, Resistance, Loyalty: Military Behavior during Unrest in Authoritarian Regimes",2016,1.0,yes,,,,,,,,,,,,,
Magaloni2010-wl,ARTICLE,Political order and one-party rule,2010-05-01,10.1146/annurev.polisci.031908.220529,True,True,200,Political Order and One-Party Rule,2010,1.0,yes,,,,,,,,,,,,,
Svolik2012-yq,BOOK,Cambridge studies in comparative politics: The politics of authoritarian rule,2012-09-17,10.1017/cbo9781139176040,True,True,200,The Politics of Authoritarian Rule,2012,0.62,yes,,,,,,,,,,,,,
Marquez2016-tj,ARTICLE,The irrelevance of legitimacy,2016-04,10.1111/1467-9248.12202,True,True,200,The Irrelevance of Legitimacy,2016,1.0,yes,,,,,,,,,,,,,
Dagher2021-is,BOOK,Reconstructing our understanding of state legitimacy in post-conflict states: Building on local perspectives,2021-02-21,10.1007/978-3-030-67254-6,True,True,200,Reconstructing our Understanding of State Legitimacy in Post-conflict States,2021,0.83,yes,,,,,,,,,,,,,
Huang2023-nq,ARTICLE,"Economic inequality, distributive unfairness, and regime support in East Asia",2023-02-17,10.1080/13510347.2022.2127146,True,True,200,"Economic inequality, distributive unfairness, and regime support in East Asia",2023,1.0,yes,,,,,,,,,,,,,
Purdey2016-dr,ARTICLE,"Evolving power of provincial political families in Thailand: Dynastic power, party machine and ideological politics",2016-09,10.1177/0967828x16659570,True,True,200,Evolving power of provincial political families in Thailand,2016,0.69,yes,,,,,,,,,,,,,
Oana2024-ca,ARTICLE,The COVID-19 lockdown paradox: democratic support during democratic restrictions,2024-11-13,10.1017/s1755773924000298,True,True,200,The COVID-19 lockdown paradox: democratic support during democratic restrictions,2025,1.0,no,,,,,,,,,,,,,
Pedrazzani2023-hd,ARTICLE,Is democracy effective against Coronavirus? An analysis of citizens’ opinions in Italy,2023,10.2139/ssrn.3970964,True,True,200,Is Democracy Effective Against Coronavirus? An Analysis of Citizens’ Opinions in Italy,2023,1.0,yes,,,,,,,,,,,,,
Hirosato2009-mj,BOOK,"The political economy of educational reforms and capacity development in southeast Asia: Cases of Cambodia, Laos and Vietnam",2009-01-01,10.1007/978-1-4020-9377-7,True,True,200,The Political Economy of Educational Reforms and Capacity Development in Southeast Asia,2009,0.83,yes,,,,,,,,,,,,,
Tang2016-nl,BOOK,Populist authoritarianism: Chinese political culture and regime sustainability,2016-04-21,10.1093/acprof:oso/9780190205782.001.0001,True,True,200,Populist Authoritarianism,2016,0.49,yes,,,,,,,,,,,,,
La2020-jv,ARTICLE,"Policy response, social media and science journalism for the sustainability of the public health system amid the COVID-19 outbreak: The Vietnam lessons",2020-04-07,10.3390/su12072931,True,True,200,"Policy Response, Social Media and Science Journalism for the Sustainability of the Public Health System Amid the COVID-19 Outbreak: The Vietnam Lessons",2020,1.0,yes,,,,,,,,,,,,,
Nicholson2023-kt,ARTICLE,Making the list: Reevaluating political trust and social desirability in China,2023-08,10.1017/s0003055422000946,True,True,200,Making the List: Reevaluating Political Trust and Social Desirability in China,2023,1.0,yes,,,,,,,,,,,,,
Shi2001-ga,ARTICLE,Cultural values and political trust: A comparison of the people's republic of China and Taiwan,2001-07,10.2307/422441,True,True,200,Cultural Values and Political Trust: A Comparison of the People's Republic of China and Taiwan,2001,1.0,yes,,,,,,,,,,,,,
Seeger2006-hv,ARTICLE,Best practices in crisis communication: An expert panel process,2006-08,10.1080/00909880600769944,True,True,200,Best Practices in Crisis Communication: An Expert Panel Process,2006,1.0,yes,,,,,,,,,,,,,
Hetherington2003-oq,ARTICLE,Anatomy of a rally effect: George W. bush and the war on terrorism,2003-01,10.1017/s1049096503001665,True,True,200,Anatomy of a Rally Effect: George W. Bush and the War on Terrorism,2003,1.0,yes,,,,,,,,,,,,,
Duch2008-zu,BOOK,The economic vote: How political and economic institutions condition election results. Political economy of institutions and decisions,2008-03-31,10.1017/cbo9780511755934,True,True,200,The Economic Vote,2008,0.23,yes,,,,,,,,,,,,,
Luhrmann2020-fv,ARTICLE,Autocratization by decree: States of emergency and democratic decline,2020,10.2139/ssrn.3582527,True,True,200,Autocratization by Decree: States of Emergency and Democratic Decline,2020,1.0,yes,,,,,,,,,,,,,
Gehlbach2015-us,ARTICLE,Electoral manipulation as bureaucratic control: Electoral manipulation as bureaucratic control,2015-01,10.1111/ajps.12122,True,True,200,Electoral Manipulation as Bureaucratic Control,2015,0.66,yes,,,,,,,,,,,,,
Anderson2007-rf,ARTICLE,The end of economic voting? Contingency dilemmas and the limits of democratic accountability,2007-06-01,10.1146/annurev.polisci.10.050806.155344,True,True,200,The End of Economic Voting? Contingency Dilemmas and the Limits of Democratic Accountability,2007,1.0,yes,,,,,,,,,,,,,
Wang2021-ck,ARTICLE,COVID-19 and the anatomy of the rally effect in Taiwan,2021-06-01,10.1525/as.2021.61.3.388,True,True,200,COVID-19 and the Anatomy of the Rally Effect in Taiwan,2021,1.0,yes,,,,,,,,,,,,,
Mueller1970-kf,ARTICLE,Presidential popularity from Truman to Johnson,1970-03,10.2307/1955610,True,True,200,Presidential Popularity from Truman to Johnson,1970,1.0,yes,,,,,,,,,,,,,
Lewis-Beck2000-do,ARTICLE,Economic determinants of electoral outcomes,2000-06,10.1146/annurev.polisci.3.1.183,True,True,200,Economic Determinants of Electoral Outcomes,2000,1.0,yes,,,,,,,,,,,,,
Geddes1999-ip,ARTICLE,What do we know about democratization after twenty years?,1999-06,10.1146/annurev.polisci.2.1.115,True,True,200,What Do We Know About Democratization After Twenty Years?,1999,1.0,yes,,,,,,,,,,,,,
Dalton2005-su,ARTICLE,Authority orientations and democratic attitudes: A test of the ‘Asian values’ hypothesis,2005-08,10.1017/s1468109905001842,True,True,200,Authority Orientations and Democratic Attitudes: A Test of the ‘Asian Values’ Hypothesis,2005,1.0,yes,,,,,,,,,,,,,
Baum2002-tc,ARTICLE,The constituent foundations of the rally-round-the-flag phenomenon,2002-06,10.1111/1468-2478.00232,True,True,200,The Constituent Foundations of the Rally-Round-the-Flag Phenomenon,2002,1.0,yes,,,,,,,,,,,,,
Bol2021-yz,ARTICLE,The effect of COVID‐19 lockdowns on political support: Some good news for democracy?,2021-05,10.1111/1475-6765.12401,True,True,200,The effect of COVID‐19 lockdowns on political support: Some good news for democracy?,2021,1.0,yes,,,,,,,,,,,,,
Stockmann2012-xq,BOOK,"Communication, society and politics: Media commercialization and authoritarian rule in China",2012-12-17,10.1017/cbo9781139087742,True,True,200,Media Commercialization and Authoritarian Rule in China,2012,0.76,yes,,,,,,,,,,,,,
Lupia1994-jp,ARTICLE,Shortcuts versus encyclopedias: Information and voting behavior in California insurance reform elections,1994-03,10.2307/2944882,True,True,200,Shortcuts Versus Encyclopedias: Information and Voting Behavior in California Insurance Reform Elections,1994,1.0,yes,,,,,,,,,,,,,
Lohani2020-lo,ARTICLE,Rapidly accelerating deforestation in Cambodia’s Mekong River basin: A comparative analysis of spatial patterns and drivers,2020-08-04,10.3390/w12082191,True,True,200,Rapidly Accelerating Deforestation in Cambodia’s Mekong River Basin: A Comparative Analysis of Spatial Patterns and Drivers,2020,1.0,yes,,,,,,,,,,,,,
Simpser2013-pf,BOOK,"Political economy of institutions and decisions: Why governments and parties manipulate elections: Theory, practice, and implications: Theory, practice, and implications",2013-03-18,10.1017/cbo9781139343824,True,True,200,Why Governments and Parties Manipulate Elections,2013,0.46,yes,,,,,,,,,,,,,
Mawdsley2022-ez,ARTICLE,Rethinking d/development,2022-02,10.1177/03091325211053115,True,True,200,Rethinking d/Development,2022,1.0,yes,,,,,,,,,,,,,
Bratton2012-cc,ARTICLE,Citizen perceptions of local government responsiveness in sub-Saharan Africa,2012-03,10.1016/j.worlddev.2011.07.003,True,True,200,Citizen Perceptions of Local Government Responsiveness in Sub-Saharan Africa,2012,1.0,yes,,,,,,,,,,,,,
Charmaz2014-lz,ARTICLE,Grounded theory in global perspective: Reviews by international researchers,2014-11,10.1177/1077800414545235,True,True,200,Grounded Theory in Global Perspective,2014,0.67,yes,,,,,,,,,,,,,
Meesuwan2025-qq,ARTICLE,The association between delegative democratic attitudes and perceptions of China in Thailand from the Asian Barometer Survey,2025,10.1016/j.ssaho.2025.101680,True,True,200,The association between delegative democratic attitudes and perceptions of China in Thailand from the Asian Barometer Survey,2025,1.0,yes,,,,,,,,,,,,,
Chheang2021-td,ARTICLE,Cambodia in 2020: Regime legitimacy tested,2021,10.1355/aa21-1e,True,True,200,Cambodia in 2020: Regime Legitimacy Tested,2021,1.0,yes,,,,,,,,,,,,,
Thayer2011-te,BOOK,Political legitimacy in Asia: New leadership challenges,2011-11-09,10.1057/9781137001474,True,True,200,Political Legitimacy in Asia,2011,0.68,yes,,,,,,,,,,,,,
VanderWeele2017-jh,ARTICLE,Sensitivity analysis in observational research: Introducing the E-value,2017-08-15,10.7326/M16-2607,True,True,200,Sensitivity Analysis in Observational Research: Introducing the E-Value,2017,1.0,yes,,,,,,,,,,,,,
McCargo2019-rx,ARTICLE,Southeast Asia's troubling elections: Democratic demolition in Thailand,2019,10.1353/jod.2019.0056,True,True,200,Southeast Asia's Troubling Elections: Democratic Demolition in Thailand,2019,1.0,yes,,,,,,,,,,,,,
Dinesen2013-fw,ARTICLE,The effect of terror on institutional trust: New evidence from the 3/11 Madrid terrorist attack: Effect of terror on institutional trust,2013-12,10.1111/pops.12025,True,True,200,The Effect of Terror on Institutional Trust: New Evidence from the 3/11 <scp>M</scp>adrid Terrorist Attack,2013,0.8,yes,,,,,,,,,,,,,
Freedom-House2025-gx,BOOK,Freedom in the world 2022: The annual survey of political rights and civil liberties,2025-06-19,10.5040/9798216424611,True,True,200,Freedom in the World 2022,2023,0.46,no,,,,,,,,,,,,,
Guriev2019-xj,ARTICLE,Informational autocrats,2019-11-01,10.1257/jep.33.4.100,True,True,200,Informational Autocrats,2019,1.0,yes,,,,,,,,,,,,,
Rozenas2019-ss,ARTICLE,How autocrats manipulate economic news: Evidence from Russia’s state-controlled television,2019-07,10.1086/703208,True,True,200,How Autocrats Manipulate Economic News: Evidence from Russia’s State-Controlled Television,2019,1.0,yes,,,,,,,,,,,,,
Petty1986-np,INBOOK,The elaboration likelihood model of persuasion,1986,10.1016/s0065-2601(08)60214-2,True,True,200,The Elaboration Likelihood Model of Persuasion,1986,1.0,yes,,,,,,,,,,,,,
van-Buuren2011-yb,ARTICLE,mice: Multivariate Imputation by Chained Equations inR,2011,10.18637/jss.v045.i03,True,True,200,<b>mice</b>: Multivariate Imputation by Chained Equations in<i>R</i>,2011,0.96,yes,,,,,,,,,,,,,
Hegewald2024-ii,ARTICLE,Who rallies around the flag? Evidence from panel data during the Covid-19 pandemic,2024-01-02,10.1080/17457289.2022.2120886,True,True,200,Who rallies around the flag? Evidence from panel data during the Covid-19 pandemic,2024,1.0,yes,,,,,,,,,,,,,
Heath2005-jp,ARTICLE,The globalization of public opinion research,2005-06-15,10.1146/annurev.polisci.8.090203.103000,True,True,200,THE GLOBALIZATION OF PUBLIC OPINION RESEARCH,2005,1.0,yes,,,,,,,,,,,,,
Guriev2020-cu,ARTICLE,A theory of informational autocracy,2020-06,10.1016/j.jpubeco.2020.104158,True,True,200,A theory of informational autocracy,2020,1.0,yes,,,,,,,,,,,,,
Gilley2003-fj,ARTICLE,The limits of authoritarian resilience,2003-01,10.1353/jod.2003.0008,True,True,200,China's Changing of the Guard: The Limits of Authoritarian Resilience,2003,0.72,yes,,,,,,,,,,,,,
Pernia2022-gh,ARTICLE,Authoritarian values and institutional trust: Theoretical considerations and evidence from the Philippines,2022-06,10.1177/2057891121992118,True,True,200,Authoritarian values and institutional trust: Theoretical considerations and evidence from the Philippines,2022,1.0,yes,,,,,,,,,,,,,
Zhao2017-yw,ARTICLE,Les déterminants de la confiance du public dans le gouvernement : données empiriques en provenance de la Chine urbaine,2017-06-12,10.3917/risa.832.0365,True,True,200,Les déterminants de la confiance du public dans le gouvernement : données empiriques en provenance de la Chine urbaine,2017,0.99,yes,,,,,,,,,,,,,
Ma2014-jj,ARTICLE,Authoritarian orientations and political trust in east Asian societies,2014-12,10.1007/s12140-014-9217-z,True,True,200,Authoritarian Orientations and Political Trust in East Asian Societies,2014,1.0,yes,,,,,,,,,,,,,
Wong2011-zv,ARTICLE,The bases of political trust in six Asian societies: Institutional and cultural explanations compared,2011-06,10.1177/0192512110378657,True,True,200,The bases of political trust in six Asian societies: Institutional and cultural explanations compared,2011,1.0,yes,,,,,,,,,,,,,
Baniamin2025-rx,ARTICLE,Institutional trust and its connection with governance quality and performance: Understanding the East and Southeast Asian paradox,2025-03-13,10.1177/20578911251326142,True,True,200,Institutional trust and its connection with governance quality and performance: Understanding the East and Southeast Asian paradox,2025,1.0,yes,,,,,,,,,,,,,
Miller1990-qm,ARTICLE,"Political parties and confidence in government: A comparison of Norway, Sweden and the United States",1990-07,10.1017/s0007123400005883,True,True,200,"Political Parties and Confidence in Government: A Comparison of Norway, Sweden and the United States",1990,1.0,yes,,,,,,,,,,,,,
Svolik2012-es,BOOK,Cambridge studies in comparative politics: The politics of authoritarian rule,2012-09-17,10.1017/cbo9781139176040,True,True,200,The Politics of Authoritarian Rule,2012,0.62,yes,,,,,,,,,,,,,
Desmond2012-qx,ARTICLE,Disposable ties and the urban poor,2012-03,10.1086/663574,True,True,200,Disposable Ties and the Urban Poor,2012,1.0,yes,,,,,,,,,,,,,
noauthor_undated-gl,ARTICLE,Economic sociology as disequilibrium economics: a contribution to the critique of the new economic sociology,,10.1111/1467-954X.12179,True,True,200,Economic Sociology as Disequilibrium Economics: A Contribution to the Critique of the New Economic Sociology,2014,1.0,,,,,,,,,,,,,,
Bratton2001-ug,ARTICLE,Support for democracy in Africa: Intrinsic or instrumental?,2001,10.1017/s0007123401000175,True,True,200,Support for Democracy in Africa: Intrinsic or Instrumental?,2001,1.0,yes,,,,,,,,,,,,,
Cameron2008-aw,ARTICLE,Bootstrap-based improvements for inference with clustered errors,2008-08,10.1162/rest.90.3.414,True,True,200,Bootstrap-Based Improvements for Inference with Clustered Errors,2008,1.0,yes,,,,,,,,,,,,,
Shin2020-fg,ARTICLE,South Korea's democratic decay,2020,10.1353/jod.2020.0048,True,True,200,South Korea's Democratic Decay,2020,1.0,yes,,,,,,,,,,,,,
Hanifan1916-ei,ARTICLE,The rural school Community Center,1916-09,10.1177/000271621606700118,True,True,200,The Rural School Community Center,1916,1.0,yes,,,,,,,,,,,,,
Lehmann2014-ex,ARTICLE,Habitus transformation and hidden injuries: Successful working-class university students,2014-01,10.1177/0038040713498777,True,True,200,Habitus Transformation and Hidden Injuries,2014,0.66,yes,,,,,,,,,,,,,
Moon2025-pt,ARTICLE,"Explaining mainstream news media use in the context of the COVID-19 pandemic: The roles of partisanship, perceptions of threat, negative emotions, and news media trust",2025-11-02,10.1080/15205436.2024.2366228,True,True,200,"Explaining Mainstream News Media Use in the Context of the COVID-19 Pandemic: The Roles of Partisanship, Perceptions of Threat, Negative Emotions, and News Media Trust",2025,1.0,yes,,,,,,,,,,,,,
Friedman2016-ej,ARTICLE,Habitus clivé and the emotional imprint of social mobility,2016,10.1111/1467-954X.12280,True,True,200,Habitus Clivé and the Emotional Imprint of Social Mobility,2016,1.0,yes,,,,,,,,,,,,,
Stephens2012-mq,ARTICLE,Unseen disadvantage: how American universities' focus on independence undermines the academic performance of first-generation college students,2012-06,10.1037/a0027143,True,True,200,Unseen disadvantage: How American universities' focus on independence undermines the academic performance of first-generation college students.,2012,1.0,yes,,,,,,,,,,,,,
Granovetter1985-kt,ARTICLE,Economic action and social structure: The problem of embeddedness,1985-11,10.1086/228311,True,True,200,Economic Action and Social Structure: The Problem of Embeddedness,1985,1.0,yes,,,,,,,,,,,,,
Granovetter1973-hw,ARTICLE,The strength of weak ties,1973-05,10.1086/225469,True,True,200,The Strength of Weak Ties,1973,1.0,yes,,,,,,,,,,,,,
Portes1998-io,ARTICLE,Social capital: Its origins and applications in modern sociology,1998-08,10.1146/annurev.soc.24.1.1,True,True,200,Social Capital: Its Origins and Applications in Modern Sociology,1998,1.0,yes,,,,,,,,,,,,,
Inglehart1997-gw,BOOK,"Modernization and postmodernization: Cultural, economic, and political change in 43 societies",1997-05-05,10.1515/9780691214429,True,True,200,Modernization and Postmodernization,1997,0.56,yes,,,,,,,,,,,,,
Meyer1997-pk,ARTICLE,World society and the nation‐state,1997-07,10.1086/231174,True,True,200,World Society and the Nation‐State,1997,1.0,yes,,,,,,,,,,,,,
Boltanski2022-jv,BOOK,De la justification: Les économies de la grandeur,2022-02-10,10.3917/gall.theve.2022.01,True,True,200,De la justification,2022,0.58,yes,,,,,,,,,,,,,
Clayton2002-cb,ARTICLE,Language choice in a nation under transition: The struggle between English and French in Cambodia,2002-03,10.1023/a:1014563027881,True,True,200,Language choice in a nation under transition: The struggle between English and French in Cambodia,2002,1.0,yes,,,,,,,,,,,,,
Baez2002-jf,ARTICLE,"Confidentiality in qualitative research: reflections on secrets, power and agency",2002-04,10.1177/1468794102002001638,True,True,200,"Confidentiality in qualitative research: reflections on secrets, power and agency",2002,1.0,yes,,,,,,,,,,,,,
Chu2010-nb,ARTICLE,Solving an Asian Puzzle,2010,10.1353/jod.2010.0009,True,True,200,The Meanings of Democracy: Solving an Asian Puzzle,2010,0.64,yes,,,,,,,,,,,,,
Marcus1995-wa,ARTICLE,Ethnography in/of the world system: The emergence of multi-sited ethnography,1995-10,10.1146/annurev.an.24.100195.000523,True,True,200,Ethnography in/of the World System: The Emergence of Multi-Sited Ethnography,1995,1.0,yes,,,,,,,,,,,,,
Olmos-Vega2022-he,ARTICLE,A practical guide to reflexivity in qualitative research: AMEE Guide No. 149,2022-04-07,10.1080/0142159X.2022.2057287,True,True,200,A practical guide to reflexivity in qualitative research: AMEE Guide No. 149,2023,1.0,no,,,,,,,,,,,,,
Noren-Nilsson2020-ev,ARTICLE,Pathways to leadership within and beyond Cambodian civil society: Elite status and boundary-crossing,2020-09-04,10.17645/pag.v8i3.3020,True,True,200,Pathways to Leadership within and beyond Cambodian Civil Society: Elite Status and Boundary-Crossing,2020,1.0,yes,,,,,,,,,,,,,
Iyengar2012-ff,ARTICLE,"Affect, not ideology",2012-09-01,10.1093/poq/nfs038,True,True,200,"Affect, Not Ideology",2012,1.0,yes,,,,,,,,,,,,,
Anderson2002-cv,ARTICLE,"Winning, losing and political trust in America",2002-04,10.1017/s0007123402000133,True,True,200,"Winning, Losing and Political Trust in America",2002,1.0,yes,,,,,,,,,,,,,
Miller1974-py,ARTICLE,Political issues and trust in government: 1964–1970,1974-09,10.2307/1959140,True,True,200,Political Issues and Trust in Government: 1964–1970,1974,1.0,yes,,,,,,,,,,,,,
Esaiasson2011-po,ARTICLE,Electoral losers revisited – How citizens react to defeat at the ballot box,2011-03,10.1016/j.electstud.2010.09.009,True,True,200,Electoral losers revisited – How citizens react to defeat at the ballot box,2011,1.0,yes,,,,,,,,,,,,,
